{
  "$schema": "../../conformance/parity/manifest.schema.json",
  "sdk": "swift",
  "runtimes": ["macos", "ios"],
  "testRoots": [
    "sdks/swift/Tests/PolarisKeyTests",
    "sdks/swift/Tests/PolarisKeyUICoreTests",
    "sdks/swift/Tests/PolarisKeyUISnapshotTests",
    "tools/gen-mirrors.test.ts"
  ],
  "features": {
    "core.verify": {
      "status": "implemented"
    },
    "core.cache": {
      "status": "implemented"
    },
    "core.bundle": {
      "status": "implemented"
    },
    "core.discover": {
      "status": "implemented"
    },
    "core.presentation": {
      "status": "implemented"
    },
    "core.sync": {
      "status": "implemented"
    },
    "core.local": {
      "status": "implemented"
    },
    "core.headers": {
      "status": "implemented"
    },
    "core.errors": {
      "status": "implemented"
    },
    "core.caps": {
      "status": "implemented"
    },
    "core.store": {
      "status": "implemented",
      "note": "macOS uses the data-protection keychain where entitled; an unentitled process (an unsigned CLI) keeps the file-based keychain and storeStatus() reports legacy-keychain."
    },
    "core.copy": {
      "status": "implemented",
      "note": "ErrorCopy serves the generated Copy.generated.swift tables: message(code)/title(code) look a code up in COPY_CODES, then COPY_GATE, then COPY_ACTIVATION; activationMessage/activationTitle (and ActivationResult.message/title) read COPY_ACTIVATION only; an unknown code reads COPY_FALLBACK naming it; {name} placeholders are filled from params or dropped; setOverrides is the host's English layer. The hand-written table is gone; PolarisCopy's gate titles and subtitles default to the gate table (ErrorCopyTests)."
    },
    "core.backend": {
      "status": "implemented",
      "note": "client.backend (PolarisKey.BackendClient): data(for:) and headers() send X-PKey-License and X-PKey-Device only; backendOrigins (exact scheme/host/port, https except loopback) is checked before the request and on every redirect hop before it is sent; the freshness pre-sync, one shared sync, one forced sync and retry on license_stale/license_invalid (at least 10 s apart), and not_entitled/sign_in_required thrown typed. BackendTests replays backend-matrix.json's client rows."
    },
    "core.devicekeys": {
      "status": "implemented"
    },
    "license.gate": {
      "status": "implemented"
    },
    "license.signedinuser": {
      "status": "implemented"
    },
    "license.activate": {
      "status": "implemented"
    },
    "license.enroll": {
      "status": "implemented"
    },
    "license.deactivate": {
      "status": "implemented"
    },
    "license.manage": {
      "status": "implemented",
      "note": "PX-W8: the device-limit result exposes manageUrl (validated), plus the return and key helpers."
    },
    "license.entitlements": {
      "status": "implemented"
    },
    "license.channels": {
      "status": "implemented"
    },
    "license.reregister": {
      "status": "implemented"
    },
    "license.refusals": {
      "status": "implemented"
    },
    "config.resolve": {
      "status": "implemented",
      "note": "Member names compare by scalar value, but JSONValue keeps the first of two canonically equivalent names (WIRE-CONTRACT-V3 §10)."
    },
    "config.list": {
      "status": "implemented"
    },
    "config.secret": {
      "status": "implemented"
    },
    "config.schema": {
      "status": "implemented"
    },
    "config.mint": {
      "status": "implemented"
    },
    "config.mirror": {
      "status": "implemented",
      "note": "The Swift mirror is rendered by tools/gen-mirrors.ts."
    },
    "config.local": {
      "status": "implemented",
      "note": "config.set, clear and clearAll persist through a LocalConfigStore (UserDefaults by default), validate against the catalog and raise client.events .config; config.setting(key) returns a handle whose current() gives the effective value, its source and lock, and onConfigChange(key | \"*\", listener) returns a cancellable ConfigSubscription (configChanges(key) is the AsyncStream form), fed by the same change observation as client.events for local writes and syncs (LocalConfigTests)."
    },
    "config.sync": {
      "status": "planned",
      "wp": "U-07"
    },
    "devices.fingerprint": {
      "status": "implemented"
    },
    "devices.facts": {
      "status": "implemented"
    },
    "devices.register": {
      "status": "implemented"
    },
    "devices.manage": {
      "status": "implemented"
    },
    "devices.report": {
      "status": "implemented"
    },
    "telemetry.updates": {
      "status": "implemented"
    },
    "devices.attest": {
      "status": "implemented",
      "except": [
        {
          "runtime": "macos",
          "reason": "runtime"
        },
        {
          "runtime": "ios",
          "reason": "outlet"
        }
      ],
      "note": "client.devices.attest() (PolarisKey/DevicesClient.swift): POST devices/attest/challenge, DCAppAttestService.attestKey over SHA-256(UTF-8(requestHash)) through PolarisKeyPlatform's AppAttestClient, POST devices/attest; the key id kept in the Keychain (account app_attest_key) and re-attested with a fresh key when a reinstall, migration or restore killed it. Registered as Core's attestor so a 403 attestation_required edge-mint or commerce claim attests once and retries once. Unsupported runtime on macOS and where App Attest does not run (the simulator); outlet on an iOS build with an embedded provisioning profile."
    },
    "identity.oidc": {
      "status": "planned",
      "wp": "I-15",
      "note": "Native browser sign-in (loopback, scheme, claimed HTTPS) waits on I-15; the host-supplied https redirect is identity.redirect.web. The device-code route is client.identity.signIn.start(SignInOptions(browser:)), which opens the device-code verification URL in ASWebAuthenticationSession; session.wait() polls /identity/auth/device/poll (identity.devicecode; the old /identity/auth/poll is retired and the Worker no longer serves it)."
    },
    "identity.devicecode": {
      "status": "implemented"
    },
    "identity.devicelabel": {
      "status": "implemented",
      "note": "PX-W13: normalizeDeviceLabel over Unicode scalars, CoreOptions.deviceName and the platform default (macOS Host.current().localizedName, iOS-family UIDevice.current.name), on signIn.start, activation and registration; SignInPrompt.deviceName is the Worker's echo. PolarisKeyUI has no device-code sign-in view to show it in (ui.kit is planned and unowned)."
    },
    "identity.toggle": {
      "status": "implemented"
    },
    "identity.attach": {
      "status": "implemented"
    },
    "identity.account": {
      "status": "implemented"
    },
    "identity.redirect.web": {
      "status": "implemented",
      "note": "signIn.start(SignInOptions(channel: .redirect, redirectUri:)) builds the S256 authorize URL from discovery (IdentityRedirect, CryptoKit) for a browser the host opens; session.complete(callbackUrl:) checks the redirect URI, state and iss before anything is sent, then redeems the code at discovery's token endpoint. Single use; a refusal is a typed SignInError and never wipes the token. Loopback, scheme and claimed-HTTPS redirects are I-15's; the licence choice (license_choice=app) is identity.choice."
    },
    "identity.choice": {
      "status": "implemented",
      "note": "SignInOptions(licenseChoice: .app) sends license_choice=app (only when discovery lists the four choice routes; else the card chooses) and session.complete(callbackUrl:) then settles .chooseLicense(PendingSignIn); identity.choice.licenses/devices/complete/cancel(grant:) take the grant, store the device token on complete like a sign-in, and throw a typed ChoiceError (invalid_grant, license_choice_required and device_limit with a fresh view, not_found, rate_limited with retryAfterSeconds); UnsupportedError(product) when a route is not published. LicenseChoiceModel (PolarisKeyUICore, @Observable) drives the LicenseChoice screen's KitInputs from the SDK."
    },
    "identity.signin.hints": {
      "status": "implemented"
    },
    "identity.exchange": {
      "status": "planned",
      "wp": "I-44",
      "note": "Sign in with Apple through ASAuthorizationController (I-44)."
    },
    "identity.autosignin": {
      "status": "planned",
      "wp": "I-44",
      "note": "autoSignIn() ladder (plan-auto-sign-in §1, I-44)."
    },
    "identity.link": {
      "status": "planned",
      "wp": "I-44",
      "note": "Link offer (I-43.3 transcripts, I-44)."
    },
    "identity.keyentry": {
      "status": "implemented"
    },
    "release.changelog": {
      "status": "implemented"
    },
    "release.download": {
      "status": "implemented"
    },
    "release.record": {
      "status": "implemented"
    },
    "release.fetch": {
      "status": "implemented",
      "note": "client.update.fetch(version:buildId:size:sha256:to:) (PolarisKeyUpdate/Install.swift) streams through the client's transport (PolarisTransport.stream) into <to>.part, resumes with Range and If-Range on the payload SHA-256 (206 appends after re-hashing the part, 200 restarts, 416 verifies), maps a refusal to the body's registered wire code, and verifies size and SHA-256 before the file appears at <to>; the replayer runs all three steps of release-fetch-gated.json."
    },
    "release.distribution": {
      "status": "implemented",
      "note": "client.distribution.downloadModel() (PolarisKey/DistributionClient.swift)."
    },
    "update.check": {
      "status": "implemented"
    },
    "update.feed": {
      "status": "implemented"
    },
    "update.feeds": {
      "status": "implemented",
      "note": "client.update.feedUrl(_:channel:velopackChannel:buildId:) over updateFeedURL (PolarisKeyUpdate/Install.swift); FeedUrlMatrixTests drives every feed-url-matrix.json row."
    },
    "update.decide": {
      "status": "implemented"
    },